id,price,baths,rooms,sqft,description,location
103076189,1097000,3,3,150,"LuxHOME SELLS SPECTACULAR APARTMENT WITH A TERRACE

We offer you this fantastic apartment located in the unbeatable neighborhood of Argüelles, ready to move in, with top-quality finishes and a wonderful layout featuring 3 bedrooms, 2 of which are en suite. It has a very pleasant terrace in the living room, and the building provides 24-hour security. 

There is the possibility of parking in the building, not included in the price. The area is extremely exclusive, right in the heart of the capital, just a 5-minute walk from Plaza de España, Templo de Debod, the Royal Palace, and Gran Vía.  

It is excellently connected and very close to transport interchanges, metro lines, and bus routes. Parks and gardens are very near the property. Immediate availability.",Moncloa
103365766,1080000,2,2,101,"Gilmar Real Estate Consulting presents a unique property for its clients in central Madrid. Discover the elegance and luxury in this stunning apartment on Gran Vía! With breathtaking panoramic views, this home offers a unique experience in the heart of the city. From sunrise to sunset, you will enjoy the majesty of the city from the comfort of your own exclusive space. 

This apartment has been meticulously designed, merging contemporary style with modern amenities. The brightness that floods every corner highlights the exquisite details of the decor, creating a cozy and sophisticated atmosphere. The living room is a sanctuary for relaxation, while the fully equipped kitchen is a dream for culinary enthusiasts. 

The spacious and well-lit bedrooms provide a serene refuge with views that will make you forget the daily stress. The bathrooms, equipped with high-end fixtures, add a touch of luxury to your daily routine. 

But the best is outside: each time you look out the window, you will witness the vibrant life of Gran Vía. With theaters, restaurants, and shops at your doorstep, this apartment becomes the epicenter of an unrivaled urban experience. 

Don't miss the opportunity to own this piece of heaven on earth. Contact us now to arrange a visit and discover how life on Gran Vía can be even more magnificent in this beautiful apartment! Don’t wait any longer! Call us right now and be the first to discover this incredible opportunity in the center of Madrid. Gilmar Real Estate Consulting is here to make your dreams of having the ideal home a reality. 

We have been working to provide our clients with the best properties for 40 years. We cover all real estate needs: homes, offices, commercial premises, land, rustic properties, and building plots. 

We have over 30 specialized teams in different areas serving more than 90,000 national and international clients who receive the necessary advice to ensure their security, legal effectiveness, and the best financial and tax profitability. 

Central Office (Chueca - Justicia, Malasaña - Universidad, Palacio, Sol, Huertas - Cortes - Paseo Florida).",Palacio
104150434,475000,1,1,72,"DE SALAS REAL ESTATE CONSULTANTS MAV02701 presents EXCLUSIVELY this little gem in the Parque del Conde de Orgaz. MANY OF OUR PROPERTIES DO NOT APPEAR ON IDEALISTA. CHECK OUR “De Salas” WEBSITE FOR MORE EXCLUSIVE HOMES. The property, with a built area of 67m2, of which 60 belong to the apartment and the rest to common elements, features a wonderful terrace of nearly 30m2, offering plenty of privacy thanks to its established greenery. Without a doubt, we have a magnificent opportunity to live in one of the few apartments with a private garden in the area. The entrance hall has a practical closet. The kitchen (7m2), with cabinetry on both sides, is perfectly utilized. The living-dining room (20m2) opens to the currently decorated garden, which has two areas: a relaxation space and a barbecue area that can be used at any time of day or night. The bedroom (8m2) includes built-in wardrobes, as well as a great dressing area next to a completely renovated bathroom with a shower and double sink. The property has parquet flooring, smooth walls, natural gas heating, and air conditioning in the living room. The home is sold with 2 parking spaces and includes common areas with a pool, solarium, garden, and paddle court.",Hortaleza
103565036,1400000,4,7,413,"PENTHOUSE WITH PERIMETER TERRACE IN COSTILLARES. Magnificent penthouse in Pinar Chamartín with a spectacular terrace and beautiful views of all of Madrid and the Sierra de Guadarrama. This property is located on the 12th and top floor and stands out for its spaciousness and brightness. The home features a large perimeter terrace of 100 m² (North, East, and West facing). Currently, the residence includes 6 spacious double bedrooms with fitted wardrobes and an office, 4 full bathrooms, a large independent kitchen with a dining area and laundry room, and a large living-dining room of 75 m² with large windows that provide great space and brightness along with impressive panoramic views. The master bedroom includes an en-suite bathroom and a walk-in closet. Most rooms have access to the terrace. The price of the property includes a storage room and a parking space (there is the possibility to acquire 2 additional parking spaces). The apartment is divisible with an approval act from the community board. Private urbanization with common and sports areas, swimming pool, tennis, paddle, football, and basketball courts, garden, and a concierge service from Monday to Sunday. Costillares neighborhood, located in the north of the city of Madrid and part of the Arturo Soria district, is among the top 10 neighborhoods in Madrid for its green spaces and accessibility. Can you imagine living here? MANY OF OUR PROPERTIES DO NOT APPEAR ON IDEALISTA, CHECK OUR WEBSITE TO SEE MORE EXCLUSIVE PROPERTIES.",Ciudad Lineal
103410984,1800000,6,5,440,"Spacious apartment consisting of 360m² plus an independent loft apartment of 80m², with the possibility of connecting it to the main residence. The apartment, located near Pio XII, is entirely exterior, enjoying great brightness. It is also very quiet, as there is only one unit per floor and it is located on a residential street. From the hall, we access the large living room with windows divided into two areas: a study or sitting area and a spacious dining room, as well as a guest toilet and a coat closet. The private area of the master bedroom includes a walk-in closet and a double bathroom. On the other side of the hall, we access the bedroom area, the kitchen, and the service area through a wide corridor. It features a sitting room (or bedroom), a room with an en-suite bathroom, and two bedrooms that share a bathroom. The kitchen is currently separated by glass partitions from the spacious office. It includes a large laundry room and a service room with its own bathroom. Upstairs, we find the independent loft, which is currently divided into a large study area, kitchen, full bathroom, and two pleasant terraces, as well as storage space. The great advantage is that it can be connected to the main residence via a staircase from the living room or the study. The property is located near the Chamartín Club, where you can play tennis, paddle tennis, enjoy the gym, and take advantage of the pool—an oasis within Nueva España.",Chamartín
104052706,300000,2,4,98,"Apartment in Vinateros, Moratalaz, with an area of 92 m2. This property features a living room, 4 bedrooms, and 2 bathrooms, making it an ideal space for families or those needing extra rooms for work or hosting guests. One of the standout features of this property is its brightness, thanks to its south-facing orientation and its exterior condition. This allows natural light to flood every corner of the home, creating a cozy and warm atmosphere. Additionally, the apartment has central heating and air conditioning, ensuring comfort throughout all seasons of the year. 

The building where this apartment is located has an elevator, making access to all floors convenient. In terms of location, the Vinateros neighborhood offers a wide range of services and amenities, being close to schools, health centers, pharmacies, supermarkets, sports centers, and small shops. 

Regarding public transportation, there are various urban buses from the EMT, and it is close to the Artilleros L9 metro station, with direct access to the A3 and M30 highways, facilitating travel around the city. 

In summary, this apartment in Vinateros is an excellent opportunity for those looking for a spacious and bright home in a convenient location. The neighborhood provides a variety of services and amenities, and the proximity to schools, shopping centers, and public transportation options makes it an ideal choice for families and professionals. 

If you are interested in obtaining more information about this property, please provide the reference [Property Reference Number] to the GILMAR team. Since 1983, GILMAR has been helping clients find their dream homes, offering professional and personalized service. You can contact us at our office at Avda. del Mediterráneo, 44, or by calling us. We will be happy to assist you in your real estate search.",Moratalaz
101096930,1700000,7,6,595,"Exceptional estate, just 7 minutes from Moncloa. Excellent transport links and services in the area. NO FEES FOR THE BUYER. Property distribution (features 2 fireplaces): Ground floor: Spacious hallway, large living-dining room, ample kitchen with all appliances, and a service room with bathroom. Half bath and 2 bedrooms (one of them with an en-suite bathroom and walk-in closet). First floor: 3 bedrooms, with en-suite bathroom and walk-in closet. Second floor: large room for various uses. Features: Exterior carpentry with climalit glass. Interior wooden carpentry. Electric heating. Built-in wardrobes. Well-maintained condition. Parking space for several vehicles. Pool, sauna, garden shed, gym, and basement for storage. There are no architectural barriers on the ground floor. We are available to show you the property. Please contact us via email.",El Plantío
102871288,475000,2,4,98,"GILMAR Real Estate Consulting ARTURO SORIA is marketing this BEAUTIFUL FOUR-BEDROOM APARTMENT WITH A TERRACE. With unbeatable communication, it is located next to the Metro and several bus lines, as well as all the services necessary for the daily needs of the residents. The home is very bright with a highly functional layout designed to ensure the comfort and well-being of its future owners. Its southern orientation, along with its height, guarantees natural light at any time of the day, as well as magnificent views from the terrace and all its rooms. 

The house consists of an entrance hall, a kitchen with a large laundry and drying area, and a living-dining room, from which you access the CHARMING TERRACE to enjoy the tranquility of the gardens in the urbanization. The sleeping area includes four bedrooms and two full bathrooms, creating a cross breeze for easy ventilation of the property. 

It is sold with A LARGE STORAGE ROOM and A PARKING SPACE, in addition to having surface parking available for residents of the urbanization. The urbanization features gardens and areas designated for the entertainment of children. 24-HOUR CONCIERGE SERVICE. Individual natural gas heating. Air conditioning via split units. 

GILMAR CONSULTING INMOBILIARIO-ARTURO SORIA (Tel.) markets the best option to sell your home. The Arturo Soria neighborhood is one of the most prestigious and luxurious in Madrid, with an excellent location near the urban center and all services, making it perfect to enjoy tranquility without giving up the proximity of a large city. 

This privileged environment is home to multiple embassies and some of the best national and international educational institutions, both private and public, with a wide range of offers (Arturo Soria School, French Lyceum [Lycée Français], Bilingual Concerted Center Nuestra Señora del Buen Consejo, San José del Parque School (Maristas), Ramón y Cajal School, Nuestra Señora de Santa María School, Parque Conde Orgaz School, International School of Madrid, ESIC Business School, Stella Maris School, Mater Inmaculada School, Brains School, etc.). 

Hospital coverage is an added value of the area (Nuestra Señora de América, Clínica Belén, Ramón y Cajal Hospital, La Paz Hospital, and M.D. Anderson). Nearby, we find the IFEMA Exhibition Center, Arturo Soria Plaza Shopping Center, Palacio de Hielo, Hipercor, El Corte Inglés, and Gran Vía de Hortaleza Shopping Center. Additionally, there are sports centers like the Swimming Club, Chamartin Tennis Club, golf clubs such as ""Golf Olivar de la Hinojosa,"" and beautiful parks, notably Juan Carlos I and Juan Pablo II. 

The proximity to the Arturo Soria Metro Line 4 and various bus lines such as 9, 11, 70, 122, or N3 guarantees quick access to the center. Access to the M30, M40, M11, and NII motorways is immediate. The closeness to Adolfo Suárez Madrid Barajas International Airport and Chamartín Station is an added value. A unique opportunity to live in one of the most privileged residential enclaves of Madrid.",Hortaleza
98271193,835000,5,4,302,"aProperties presents a corner townhouse to renovate, measuring 280 m² on a 300 m² plot, featuring a private pool and a garden that surrounds the house on all sides in the exclusive area of El Plantío. The main floor boasts a magnificent living-dining room with different atmospheres, a fireplace, and a balcony overlooking the pool, as well as a fully equipped kitchen, a bright sitting room or office, and a guest bathroom. The sleeping area includes a master bedroom with an en-suite bathroom and a sitting area, along with two additional bedrooms and another bathroom plus a guest toilet. The ground floor consists of a large living room with a fireplace, a bathroom, a pantry, a storage room, and a garage for two vehicles. There is the possibility of opening the attic, which is prepared with water and electricity connections and openings for several windows. Excellent public and private transport links, with immediate access to the A6 and very close to the train station. Just 5 minutes from schools and commercial areas like Sexta Avenida and Hipercor, and 10 minutes from Madrid. MANY OF OUR PROPERTIES ARE NOT LISTED ON IDEALISTA, PLEASE CHECK OUR WEBSITE TO SEE MORE EXCLUSIVE PROPERTIES.",Moncloa
102985937,1490000,3,2,133,"EXTERIOR APARTMENT WITH LUXURY RENOVATION FOR SALE IN GOYA. In the prestigious Barrio de Salamanca, just a few meters walking distance from the Golden Mile and two minutes from the iconic Retiro Park, APROPERTIES offers for sale this magnificent and elegant home that has been fully renovated and furnished. It is a very bright second-floor apartment facing south. Its 133 m² are harmoniously distributed in a night area consisting of two spacious double bedrooms, two en-suite bathrooms, and a third courtesy toilet. The master bedroom features a dressing room with bronze aluminum profiles, and the second bedroom includes a custom-built fitted wardrobe with ample storage capacity. The day area includes a spacious and bright open living room with large windows that allow beautiful light to fill the entire space. Semi-integrated is an elegant kitchen equipped with high-end appliances. The apartment also features an independent laundry room. The spectacularly designed renovation is executed with top-quality materials, meticulously caring for every detail and corner of the home. It has central heating with original reclaimed iron radiators in the living room and bedrooms, equipped with individual meters. The air conditioning system is centralized with concealed ducts and zoning (Airzone). The carefully curated and beautiful decoration of each of its rooms makes this home unique in the area. The apartment is located in an elegant classic building with an elevator and has concierge services. The home comes smart home-equipped with individual control of lighting and the possibility of control via screen and mobile devices, as well as voice commands. This is undoubtedly a unique opportunity to acquire this exclusive and elegant residence located in one of the best areas of the capital. Can you imagine living here? MANY OF OUR PROPERTIES DO NOT APPEAR ON IDEALISTA, CHECK OUR WEBSITE TO SEE MORE EXCLUSIVE PROPERTIES.",Goya
104051136,4300000,3,10,451,"PROMORA MADRID sells an office in the Salamanca neighborhood, Castellana area, spanning 451 m². It features ten offices, a small kitchen, three bathrooms, and a service door, with heating and air conditioning. This property is located on the first floor of a building with a physical doorman and elevator, on one of the most representative streets of the Salamanca neighborhood. The space is currently distributed with a large reception hall, five offices or meeting rooms with large windows facing Velázquez Street, four interior offices facing courtyards, two storage rooms, and various spacious areas for workstations. It also includes a small kitchen, three bathrooms, and an independent service entrance. It is equipped with air conditioning and central heating. MANY OF OUR PROPERTIES DO NOT APPEAR ON IDEALISTA, CHECK OUR WEBSITE TO SEE MORE EXCLUSIVE PROPERTIES. Without a doubt, this is the quintessential select district of Madrid. Walking through the streets of the Salamanca neighborhood allows you to admire the most elegant and sought-after buildings in the capital: historic constructions with grand entrances and spacious, high interiors. Designed in the late 19th century by D. José de Salamanca y Mayol, Marquis of Salamanca, this expansion of the city retains its aristocratic air, which can be seen in palaces like the Italian Embassy, for example. In this epicenter of luxury is the renowned ""Golden Mile"": a commercial area where prestigious brands such as Dior, Chanel, Prada, and Tiffany are located. Stores like Gallery, BD, or Vitra and restaurants like Ramsés or No cater to the tastes of a modern and sophisticated lifestyle. We are talking about a dynamic and secure area, with wide sidewalks, almost unlimited parking, and an interesting nightlife: Nxt Club, Déjate Besar, or Le Boutique Club. Art galleries and cultural spaces like the Fundación March or the Lázaro Galdiano Museum abound. Not to mention its lush trees and proximity to Retiro Park, the great green lung of central Madrid.",Castellana
104067384,1200000,2,4,174,"GILMAR REAL ESTATE CONSULTING CENTRO is pleased to present this magnificent property located on one of the best streets in the Palacio area of Madrid. This luxurious 4-bedroom, 2-bathroom apartment, with a surface area of 174 square meters, is a true gem in the heart of the city. 

The first thing that stands out about this property is its brightness. Located on a high floor, it benefits from a large amount of natural light that floods every corner of the home. Additionally, it features two spacious balconies overlooking the street, one of which has a glass lookout, from which you can enjoy views of the area.

The apartment is situated in an excellent area, close to all the services and amenities you may need. Less than 10 kilometers away is the prestigious Santa María del Pilar school, which offers quality education for the youngest family members. There are also several nearby shopping centers, such as the Príncipe Pío Shopping Center, where you can find a wide variety of shops, restaurants, and cinemas.

Regarding transportation, the nearest metro lines are Line 5 and Line 2, with the Ópera and Santo Domingo stations just a few minutes' walk away. Additionally, commuter lines C3 and C4 stop at the Sol station, which is nearby. Finally, several bus lines pass close to the property, providing excellent connectivity to the rest of the city.

The Palacio neighborhood is known for its charm and history. Surrounded by monuments and historic buildings, such as the Royal Palace and the Almudena Cathedral, it is a vibrant place full of life and culture. Moreover, it boasts a wide range of restaurants, bars, and shops, making this neighborhood an ideal place to live.

Gilmar Real Estate Consulting has been helping clients find their dream homes since 1983. With over 30 specialized teams in various areas, we offer personalized and quality service. Our goal is to ensure the legal security and effectiveness of each transaction, as well as the best financial and tax profitability for our clients.

If you would like more information about this magnificent property, please do not hesitate to contact our team at the Centro office located at Plaza de Herradores, 4. You can call or send an email. Remember to provide the reference of the property to expedite the process.

Don't miss the opportunity to live in this luxurious apartment in one of the best areas of Madrid. Contact us today and discover your next home!",Centro
103963695,430000,2,3,91,"Stunning apartment with a swimming pool in La Paz. Engel & Völkers presents this beautiful dwelling located on the ground floor of a residential complex situated on the best street in the La Paz neighborhood. The property is fully renovated, featuring high-quality finishes, tilt-and-turn windows, and lacquered doors. It consists of 3 bedrooms and 2 bathrooms, one of which is en suite. The kitchen is furnished with an open layout, and the living-dining room measures 22 m². The apartment is completely exterior and elevated above street level, akin to a second floor. The residential complex offers 24-hour security, a concierge, and maintenance services. There is a large adult swimming pool and landscaped areas, all within a secure closed facility equipped with surveillance cameras. 

In short, this is a residential complex with top-notch services in the heart of Fuencarral. The apartment features underfloor heating and cooling. There is an option for a parking space located in the same building. The property is situated on one of the most emblematic streets in the La Paz neighborhood, within the Fuencarral district in the northern area of Madrid. It is very close to Paseo de la Castellana and the financial center of the Five Towers, with its location being particularly significant in the Madrid Nuevo Norte project, which focuses on the expansion of the Castellana-Chamartín axis. 

La Paz is characterized by its fantastic high-rise residential complexes with 24-hour security and extensive communal areas, providing tranquility and quality of life to all its residents. It is therefore an area that offers a wide variety of services such as schools, leisure and dining areas, as well as parks and green spaces. Paseo de la Castellana, hospitals La Paz, Ramón y Cajal, and the La Vaguada shopping center are just a 5-minute walk away. The public transport system ensures maximum convenience for residents of this neighborhood, with a comprehensive bus network connecting to any point in the city. Easy and quick access to the M-30, M-40, the Colmenar road, or the Burgos road makes this area a very comfortable place to live.",Fuencarral
101299128,2600000,4,3,382,"PROMORA MADRID offers a renovated apartment with 382m2 of constructed area. It has 3 bedrooms, 4 bathrooms, concierge service, and parking in the building. Virtual tour link: The apartment includes over 300m2 of constructed space, with 192m2 dedicated to living areas, which consist of a spacious entrance hall, a living-dining room with four balconies facing the street, a guest bathroom, and an integrated kitchen equipped with high-end appliances. There are three en-suite bedrooms, with the main one featuring a walk-in closet. The apartment has two direct access points from the elevator, one leading to the living area and the other to the service area. Gym, concierge service, and parking in the building. MANY OF OUR PROPERTIES DO NOT APPEAR ON IDEALISTA, CHECK OUR WEBSITE TO SEE MORE EXCLUSIVE PROPERTIES. If the neighborhoods of Salamanca, Chamberí, or Los Jerónimos have that stately and elegant atmosphere, Justicia maintains it but with a cosmopolitan touch. Strolling through Barquillo, Argensola, Almirante, or Conde de Xiquena will lead us to discover boutiques with innovative interiors, designer workshops, art galleries for emerging creators, restaurants, wine bars, terraces, and trendy clubs. Without a doubt, it is the chicest area of Madrid, with an exciting urban vibe. Let’s not forget Chueca, the gay hub of the capital, where the San Antón Market is located: a trendy, open, and casual gastronomic space. As Frank Gehry has said on more than one occasion, architecture defines the spirit of a territory, and in the Justicia neighborhood, there are no shortage of iconic buildings. From the overwhelming modernism of the Palacio de Longoria to the classicism of the Museo Romántico or the Las Salesas church, as well as more contemporary constructions like the new headquarters of the Madrid College of Architects. In addition to having a swimming pool, gym, and parking, we recommend visiting its interior garden where the Bosco de Lobos restaurant has recently opened. As if that weren't enough, starting in May, a part of the neighborhood will be included in the Priority Residential Area, meaning that its surroundings will be pedestrian-friendly and traffic will be limited to residents and public transport.",Centro
