id,price,baths,rooms,sqft,description,location
103937233,560000,2,3,74,"Bright and cozy exterior apartment in Ríos Rosas. Engel & Völkers is pleased to present this attractive property located on the first floor of a seven-story building with a south-facing orientation. The home, with a constructed area of 74 square meters, has been carefully renovated to offer comfort and functionality in every detail. The spacious living room connects with the open-plan kitchen-dining area, which features a convenient peninsula and is equipped with a dishwasher, fridge, oven, and vitroceramic cooktop. The property stands out for its three exterior bedrooms, all fully soundproofed to ensure tranquility and rest, as well as two full bathrooms, one of which is en suite. The home has heating and hot water supplied by individual gas. The hardwood floors throughout the apartment (except in the bathrooms) provide a uniform and cozy aesthetic. The smooth walls and exterior windows with thermal break in PVC, which include electric blinds, along with custom-made wooden interior windows, add a touch of elegance. At the entrance, you will find a practical loft for storage. Built in 1929, the building is protected by the municipality and includes an elevator and a physical doorman, providing comfort and security. This property blends modern elements with historical details, creating a balanced and functional environment for its future residents. Ríos Rosas, an emblematic neighborhood located in the heart of Chamberí, is bordered to the north by Raimundo Fernández Villaverde street, to the east by Paseo de la Castellana, to the south by José Abascal street, and to the west by Bravo Murillo street. In the vicinity, you can find all kinds of services and shops, local markets, and El Corte Inglés on Castellana. It is complemented by educational centers ranging from nurseries to schools, a health center, the Canal Sports Center, an excellent cultural offer with cinemas, theaters, and museums, and numerous trendy dining spots. Public transportation is excellent, with options including numerous bus lines, highlighted by lines 5, 12, and 45, several metro stations (Ríos Rosas and Alonso Cano), and commuter trains at Nuevos Ministerios with a metro line providing direct access to the airport.",Nuevos Ministerios-Ríos Rosas
97917046,529900,1,2,88,"Única Inmobiliaria presents an exterior apartment with exceptional brightness and a prime location in the center of Madrid, near Plaza España and Gran Vía. Recently renovated with high-quality materials, the property consists of 88 m² with a very functional layout: entrance hall, large living-dining room, spacious and very bright, 2 double bedrooms, both exterior, large kitchen, and a completely renovated bathroom. Features include hardwood floors, high ceilings, armored door, Climalit windows, and individual air conditioning. The building has an elevator. 

At Única Inmobiliaria, a personalized service company with over 19 years of experience and in-depth knowledge of the sector in Madrid's most exclusive areas, we have a dynamic team of professionals with higher education and experience in personal consulting. Our long professional trajectory allows us to provide excellent management and find solutions to each client's needs with the goal of achieving their satisfaction and trust. At Única Inmobiliaria, every client is ""Unique.""

WE HAVE MORE PROPERTIES IN THIS AREA THAT ARE NOT PUBLISHED ON IDEALISTA AT THE EXPRESS REQUEST OF THE OWNERS. TO VIEW THEM, CLICK ON THE ÚNICA LOGO OR VISIT OUR WEBSITE unicainmobiliaria.com.",Centro
103089497,160000,1,1,25,"Attention investors! Unique opportunity in the heart of Madrid's Rastro! This cozy loft for sale boasts a 7% yield. Currently rented out seasonally for €900/month. It is situated in a privileged location on Ribera de Curtidores street. The property underwent a complete renovation in 2012, ensuring a modern and functional living space. The apartment is located on the sixth floor of a building with an elevator, providing greater convenience for daily life. Additionally, it features a spacious living room with an open kitchen, perfect for enjoying a good meal with friends and family. The bedroom has two Velux windows that let in plenty of natural light, creating a warm and inviting atmosphere. The bathroom includes a modern and functional shower. Wooden floors and air conditioning (cool/heat) are just a few additional features that make this apartment a great investment opportunity. Don't miss the chance to live in the heart of Madrid, right in the Rastro, or to invest in a property with a prime location. Contact us for more information!",Lavapiés-Embajadores
101543462,464000,2,3,53,"Vivienda 2 presents this wonderful duplex with a ""terrace,"" featuring a design renovation, located between San Bernardo Square and Gran Vía, in a traditional building (exempt from property tax) situated on one of the quietest streets in the Malasaña neighborhood. It boasts exceptional brightness and a privileged location in the center of Madrid, *also close to Plaza España*. The home has a layout that optimizes all spaces. On the first floor, we find: a dining area + kitchen, which is fully equipped with appliances, a very bright living-dining room, a spacious bathroom with a shower, and a bright bedroom. On the second floor, under the roof, there are 2 bedrooms, a beautiful full bathroom, and a terrace with a great viewpoint. The property is located on the 3rd floor of a lovely classic building from 1900, without an elevator, featuring an elegant and comfortable staircase. In the Malasaña neighborhood, known for its blend of bohemian and modern influences, it is very close to the historic Dos de Mayo square and surrounded by all services and transport options. Do not hesitate to contact us. For public transportation, there are bus lines (2-3-147) and the Noviciado Metro on Line 2.",Malasaña-Universidad
104022088,460000,1,4,126,"APARTMENT TO RENOVATE WITH BALCONY IN ARTURO SORIA. aProperties presents for sale an apartment in one of the best areas of Arturo Soria, in front of Infantería de Marina. It is a very pleasant neighborhood with plenty of green spaces and a high level of safety. The property consists of four exterior bedrooms, one bathroom, a living room, and a kitchen with a balcony. The apartment is in need of renovation, with the possibility of adding a second bathroom and reorganizing the spaces according to the owner's preferences, as the structure features a central load-bearing wall, allowing for a complete reconfiguration of the rooms. 

Access to the building is very easy via a flight of stairs, as the apartment is elevated above the community storage rooms. Upon entering the property, one quickly notices its brightness, as it overlooks the community's private garden. Arturo Soria is regarded as one of the most exclusive districts in Madrid. It is strategically located very close to the city center and nearby all kinds of essential services. Arturo Soria is considered one of the most privileged areas for those who want to enjoy a tranquil environment without giving up proximity to the center of a large city.

Arturo Soria also has excellent transportation links, being near Madrid's main ring roads (M30 and M40) and just 5 minutes from downtown Madrid and Adolfo Suárez Madrid-Barajas International Airport (via M11 and A2). Nearby, you can find schools such as the Lycée Français, Ramón y Cajal, San José del Parque - Maristas Colegio Bristol, Santa María de la Hispanidad, Alameda de Osuna, Colegio GAUDEM, Montessori, Dallington School, Nuestra Señora Santa María, Escuela Iraquí de Madrid, Instituto Saudí de Madrid, Ecole Maternelle Française Pomme D'api, Colegio Brains María Lombillo, etc., shopping centers like El Corte Inglés, Hipercor, Arturo Soria Plaza, Plenilunio, etc., parks such as Juan Carlos I, Juan Pablo II, Quinta Molinos, Marqués Suanzes, El Capricho, etc., sports clubs: Centro Deportivo los Prunos AQA, Club de Golf Olivar de la Hinojosa, etc., business parks: Julián Camarillo, Las Mercedes, Campo de las Naciones, IFEMA, Alameda de Osuna, Barajas, etc., and hospitals such as the Clínica Universitaria de Navarra, etc. 

Can you imagine living here? MANY OF OUR PROPERTIES DO NOT APPEAR ON IDEALISTA, CHECK OUR WEBSITE FOR MORE EXCLUSIVE PROPERTIES.",Costillares
102876169,308000,1,2,54,"In the heart of the Chamberí neighborhood, this charming ground floor apartment is ready to move in. The 54m² property is laid out with an approximately 20m² living room, 2 bedrooms, with the main one being a good size, a fully renovated bathroom with a shower, a kitchen with a ceramic stovetop, and 2 storage closets. Both bedrooms come with fitted wardrobes. In 2018, a partial renovation was carried out which included a complete electrical system upgrade, the bathroom, and anti-humidity treatment for all the walls. High ceilings and plenty of light. In short, this pleasant apartment meets all the characteristics that are hard to find in a single property. The building where it is located is well maintained and has a lovely interior courtyard with a terrace for laundry. But what is unbeatable is the location: between Plaza de Chamberí and Plaza de Olavide, specifically on Raimundo Lulio Street. A gem at a very affordable price. Better to visit.",Trafalgar
103856542,230000,2,3,98,"Apartment for sale in Buenavista, located in Carabanchel with 98 m2 built area. It features an entrance hall that leads to other rooms, a living-dining room with access to a 4-meter terrace, three bedrooms (two single and one double), a fully equipped kitchen, and two complete bathrooms. 

Features: two air conditioning units (cooling/heating), laminate flooring, smooth walls, double-glazed climalit windows with thermal break, wooden doors. Thermal insulation on the wall connected to the facade and acoustic insulation on the part connecting to the neighbors. Completely renovated. Electric heating and natural gas heated water. East/West orientation. Exterior. Building in good condition. Built in 1968. Favorable ITE (Technical Inspection of Buildings). Storage room included.

About the area and transportation:
Located in the district of Carabanchel, in the south of Madrid, the Buenavista neighborhood, also known as Carabanchel Alto, is bordered by Avenida de los Poblados and Calle de Antonia Rodríguez Sacristán to the north, Avenida de la Princesa Juana de Austria to the east, the municipality of Leganés to the south, and Camino de Piqueñas, Calle de Casatejada, Calle de Muntadas, and Parque de las Cruces to the west. The neighborhood features a new housing area and a large shopping center that offers a wide variety of leisure activities. The area has good bus and metro connections (San Francisco, Carabanchel Alto, and La Peseta), as well as easy access by car due to its proximity to the M-40 motorway.",Buena Vista
103795261,2000000,3,4,216,"Bright home located on the fourth floor of a contemporary building, offering clear views from all points of the social area. It features three bedrooms, with the master bedroom being en suite, a kitchen with a servant's bedroom and bathroom. Cozy and functional, just steps away from Retiro Park, this is a highly sought-after location. The building has a doorman and offers a parking space. 

Distribution: Spacious reception area with various environments and dining room, in an open-plan space without architectural barriers. Clear views through large windows. The independent kitchen includes a servant's bedroom and bathroom. In the private area, the property has three bedrooms, the master suite with access to a small terrace and another bathroom.

Location: Salamanca-Goya is one of the neighborhoods within the Salamanca district of Madrid. It is situated in the more traditional area, blending a wide commercial offering with long-established shops, large retailers like El Corte Inglés, markets, and dining options, all within a very residential ambiance characterized by stately buildings, especially near Retiro, where this property is located. This area remains highly sought after and has a rich heritage.

Excellent transport connections: buses, Goya metro line, and great public transport links. 

Orientation: This property enjoys a south-facing facade and receives maximum light throughout the day through large windows.

Uniqueness: A magnificent opportunity to acquire a home with a spacious social area and three bedrooms, the most sought-after format for starting a family. Spacious and bright with magnificent clear views, plus a large parking space in the building. A luxury just steps away from Retiro.

Condition: The property is in good condition and offers many possibilities for a more modern layout. It features thermal and acoustic insulation, hidden air conditioning, and central heating. There is a parking space for two cars in the building along with porter service.

Profitability: The Goya-Retiro neighborhood is always a safe investment due to the high demand for such high-rise properties near Retiro. Acquiring an apartment in this area means having a secure real estate asset that does not experience the fluctuations that can affect other areas.",Barrio de Salamanca
103507566,1125000,2,4,142,"Apartment with views of El Retiro Park

Engel & Völkers exclusively offers the bare ownership of this spectacular apartment overlooking El Retiro Park. Located on the fifth floor of a characteristic building from 1935, the property spans 129 square meters, comprising a living room, four bedrooms, two bathrooms, a kitchen, and a small office. From its three large windows (in the living room and two bedrooms), one can enjoy magnificent views of El Retiro, at the height of the House of Beasts. The high ceilings and original hydraulic tile floors give personality to this bright apartment, with natural light in all rooms. Situated in a privileged location, the stunning views allow one to appreciate the changing seasons from the window. The colors of El Retiro's trees in autumn are truly spectacular. It is ideal for those wanting to live in a unique setting in the city center.

The Ibiza neighborhood, in the Retiro district, is a residential area that boasts a wide range of shops, restaurants, and cafes, making it one of the liveliest areas in the capital. The neighborhood offers all necessary services: markets and supermarkets, beauty centers, department stores, schools, sports facilities, and health centers, including the Gregorio Marañón University Hospital and the Niño Jesús Hospital.

The Buen Retiro Park is the true centerpiece of this neighborhood in Madrid. This public park is one of the favorite spots for Madrileños and is considered one of the main tourist attractions of the capital, featuring architectural and landscape elements from the 17th to the 21st century.

Transportation and communication options are excellent. There are several urban and intercity bus lines and metro stations such as Ibiza, Retiro, and Sainz de Baranda, as well as direct access to the M-30. The airport is located less than 10 kilometers away.",Retiro
103254529,2300000,3,3,237,"Exclusive apartment with pool and garages in Velázquez

Engel & Völkers is pleased to present an exclusive property on Velázquez Street. Built in 2002, it features almost two hundred square meters of living space distributed across three bedrooms (originally four), three bathrooms, a dining room, an office, and a kitchen with a pantry and laundry area. Notable for its high-quality materials, such as Carrara marble flooring in the foyer, living room, and dining area, 12 cm wide oak wood flooring set on joists, and travertine marble bathrooms. The exterior carpentry is made of lacquered aluminum and top-quality iroko wood with thermal break, as well as Climalit glass and motorized aluminum blinds on balconies and large windows, individual heating, and ducted air conditioning. From the private entrance, we access the spacious hall from which the entire property is distributed. Ahead is the living-dining room, with the rest and kitchen areas to the right and left. Two large garage spaces and a storage room complete the property. The building features granite and marble floors, elevators with access to the garage, video surveillance, and a fantastic pool with landscaped areas for the exclusive use of its residents. It's a highly attractive option for those seeking a comfortable and refined lifestyle.

The property is located in the residential neighborhood of El Viso, within the Chamartín district, to the north of the capital. El Viso is one of the most luxurious residential areas in Madrid. Its affluent population consists of businessmen, diplomats, executives, among others, which is reflected in the types of homes that are among the most valued in central Madrid. It is a very quiet and well-maintained area with nearby green spaces and enjoys excellent connectivity to the rest of the city. Additionally, the neighborhood is regulated as an S.E.R. parking zone, providing more convenience for residents. The Chamartín district offers a wide range of services, from department stores, shops, pharmacies, schools, churches, gyms, hotels, sports areas, to a selection of the best bars and restaurants in Madrid. Chamartín houses several embassies and important public administrations. The public transportation system ensures maximum comfort for residents, with approximately 50 bus lines, 7 metro lines, and two commuter stations currently available. The Chamartín station is also a terminal for most medium and long-distance trains heading to northern Spain. Other points of interest include the National Auditorium of Music, the Santiago Bernabéu football stadium, several museums, and Berlin Park.",El Viso
103211147,3000000,8,5,881,"CLASSIC MANOR HOUSE FOR SALE IN A EXCLUSIVE AREA OF MADRID. In the exclusive area of Fuentelareina in Madrid, we have a large plot of 1,393 square meters with stunning views of the golf course. On this land stands a spacious and bright house of 881 square meters, distributed over two floors. Entering through the ground floor, we find a wide hall with high ceilings that opens to the living room with views of the garden and pool. Also on the ground floor, there is a library, a guest restroom, a dining room, a kitchen, and a service room with a bathroom. On the first floor, we find the master bedroom, which has two full bathrooms, three additional bedrooms with en-suite bathrooms, and an extra bathroom. In the basement, there is a garage area, as well as a lounge and a laundry room. This property is a unique opportunity due to its privileged location in an exclusive and tranquil environment, while also being very close to commercial and entertainment areas. Can you imagine living here? MANY OF OUR PROPERTIES DO NOT APPEAR ON IDEALISTA, CHECK OUR WEBSITE TO SEE MORE EXCLUSIVE PROPERTIES.",Fuencarral
102347197,698000,2,2,108,"Next to the Hospital de La Princesa, with immediate access via the M-30 via Avenida de América, shops, restaurants, commercial areas, and public transport. The apartment has a very spacious courtyard view and unobstructed views, resulting in a very bright space. The main bedroom is currently en suite, and there is a renovation plan to redistribute it into 3 bedrooms and 2 bathrooms. The apartment is ready for updating in a classic building, with an excellent entrance and impeccable condition. It's a fantastic option both as a family residence or a second home if you are from outside Madrid and want a house in the Salamanca district, as well as for purchasing and being able to rent it out immediately for a high monthly return. 

GILMAR SALAMANCA: This distinguished residential neighborhood has become one of the most important commercial areas in the city and one of the highest standard of living neighborhoods in Europe, featuring the largest luxury shopping area in Madrid around Serrano, Claudio Coello, and Ortega y Gasset streets. It is also notable for its grand facades, making Madrid one of the most European capitals in terms of classic and avant-garde architecture. Salamanca is undoubtedly one of the most elegant and prestigious residential areas in Europe. It houses one of the city's main sports facilities, the Wizink Center, inaugurated in 2005 on the site of the former Palacio de los Deportes. Additionally, it accommodates various institutions such as the Royal Mint and the National Currency and Stamp Factory. The neighborhood is diagonally crossed by Calle de Alcalá, which, along with streets like Jorge Juan, Goya, and Hermosilla, gives it a distinctly commercial character.

At Gilmar, we have been working to offer our clients the best properties for 39 years. We cover all real estate needs: homes, offices, commercial premises, land, rustic estates, and plots for construction. We have over 30 teams specialized in different areas at the service of more than 90,000 national and international clients, providing the necessary advice to ensure their legal security, efficiency, and the best financial-tax profitability.",Lista
102956518,390000,1,0,64,"NEW LOFT NEXT TO SANTANDER PARK. Wonderful open space that has been renovated as a loft-style home on General Ibáñez de Íbero Street. The layout has 62 square meters, which include a living area, kitchen, bedroom, bathroom, laundry room, and storage. It is possible to double the space due to the height for a second floor. The location is excellent, next to Santander Park and the Geographic Institute, and very close to the Guzmán el Bueno metro station, in a well-maintained building from 1980. The property is very interesting as an investment since it has its own street access, allowing it to easily be converted into a tourist rental. A very quiet and attractive residential area, surrounded by monuments and very close to the universities. Can you imagine living here? MANY OF OUR PROPERTIES DO NOT APPEAR ON IDEALISTA, VISIT OUR WEBSITE TO SEE MORE EXCLUSIVE PROPERTIES.",Chamberí
102834380,270000,1,2,53,"Gilmar Madrid-Río sells an apartment in Ermita del Santo. The property has 53 m2 distributed into a hall, living room, kitchen, 2 bedrooms, and 1 bathroom. It is located in an idyllic area of Madrid just 100 meters from the Madrid Río park. The layout includes a hall, independent kitchen, living room, 2 bedrooms, and 1 bathroom. The kitchen is fully independent and very bright. The living room, with an excellent layout, features a workspace and a fantastic view. The bathroom is complete and has a bathtub. Both bedrooms are very spacious, especially the master bedroom. The distribution of the house is excellent, with plenty of storage space in the entrance hall. The property has Climalit windows that provide excellent thermal and acoustic insulation, parquet floors, and pine wood doors. Additionally, it has heating and hot water supplied by natural gas. The building has an elevator and is in good condition, with a favorable ITE until 2029. The apartment is located in the best residential area of Puerta del Angel, next to Ermita del Santo street. It is surrounded by local shops and is near the La Ermita del Santo shopping center. The Puerta del Angel metro station is just a 5-minute walk away, and there is a bus stop with lines L25 and L17 just 100 meters away. At Gilmar, we have been working for 40 years to offer our clients the best properties. We cover all real estate needs: residential homes, offices, commercial spaces, land plots, rustic estates, and building land. We have more than 35 specialized teams in various areas serving over 200,000 national and international clients, providing the necessary advice to ensure their security, legal efficiency, and the best financial and tax returns. Visit our website, and you will find 4,000 more opportunities.",Latina
25473186,1450000,4,5,340,"AMBASSADOR offers you this fantastic duplex penthouse in the exclusive area of Valdemarín. It features a 150-square-meter terrace. Entrance hall, guest toilet, main living room with dining area, kitchen, staff bedroom with bathroom, and a family lounge with a breakfast area. Two family bedrooms with two bathrooms and an office. Master bedroom with a walk-in closet and en-suite bathroom. On the upper floor, there is a terrace with a 90-square-meter enclosure that includes a gym and seating area. The development has a swimming pool and paddle tennis court. Valdemarín is located just 9 kilometers from Madrid, between Monte del Pardo and the A-6 Coruña road. Its proximity to Madrid and its wide variety of services have made it one of the most sought-after neighborhoods in the capital. It is perfectly connected to Madrid by car, with quick and direct access from the A6 exits 9 or 10, the M-40, and the M502 Castilla road. Without leaving Valdemarín, you can find a wide variety of services, renowned restaurants such as La Marisquería Portonovo, and more modern concepts like Barbillón, as well as several high-level sports centers like the Couder tennis school, and very close to the prestigious Club de Campo de Madrid where you can engage in various sports. You can also enjoy extensive green areas with several playgrounds, a church, and various pharmacies. Public transportation is available with several urban bus lines, including 161. In Valdemarín, you can find all types of luxury housing, from magnificent single-family homes and townhouses to modern apartments in gated communities with large common areas. Without having to leave Valdemarín, you'll find all the necessary services for a comfortable and pleasant family life. In Valdemarín itself, there are several hospitals such as Hospital Nisa de Aravaca and Hospital La Zarzuela, as well as several prestigious schools like Colegio Estudio and Colegio Montessori.",Moncloa
