id,price,baths,rooms,sqft,description,location
102032315,1750000,3,4,220,"Única Inmobiliaria offers this excellent exterior property, in need of renovation, located in the heart of the Goya neighborhood. It includes a garage with direct access and a large storage room. The building features a representative entrance from its time and has been recently renovated. 

The property spans 220 m², distributed into a living room with two areas, a library, a kitchen with a dining area, 4 bedrooms, and 3 bathrooms. A spacious entrance hall leads to the living areas, which have large windows facing the main street. One of the windows was originally a terrace that was later incorporated into the living room during renovations. 

The sleeping area consists of 3 double bedrooms, with the master bedroom featuring an en-suite bathroom and access to a terrace overlooking a very bright internal courtyard. This part of the property is particularly appealing, as it provides both privacy and abundant natural light for most of the day. The service area includes a large kitchen with a dining area and pantry. This is another feature that will facilitate renovations, as the kitchen is very close to the living rooms. Here, there is also a door leading to a terrace that connects to an elevator. 

This property represents a great opportunity to reside in one of the most sought-after neighborhoods of the capital, located just minutes from the prestigious Príncipe de Vergara street. It is only a short distance from the Retiro Park and the renowned El Corte Inglés shopping center. 

At Única Inmobiliaria, a company specializing in personalized services with over 19 years of experience and in-depth knowledge of the sector in Madrid's most exclusive areas, we have a dynamic team of professionals with advanced training and experience in personal advisory services. Our extensive professional background allows us to provide excellent management and find solutions to the needs of each client, with the goal of achieving their satisfaction and trust. 

At Única Inmobiliaria, every client is “Unique.” 

WE HAVE MORE PROPERTIES IN THIS AREA NOT PUBLISHED ON IDEALISTA AT THE EXPRESS REQUEST OF THE OWNERS. 

TO VIEW THEM, CLICK ON THE ÚNICA LOGO OR VISIT OUR WEBSITE unicainmobiliaria.com.",Barrio de Salamanca
102561685,1175000,3,3,165,"Bright designer property in a classic building Engel & Völkers luxury real estate is pleased to present a beautiful home that has been completely renovated and designed in a pure Parisian style, with a refined aesthetic that maximizes space without sacrificing style. The building dates back to 1910, preserving all the charm of the era, and is located on one of the quietest streets in the Las Letras neighborhood. It is situated on the second floor with three large windows and balconies in the living room, which provide natural light all day long. The residence has approximately three-meter high ceilings and consists of a spacious living room with an integrated kitchen, separated by folding glass doors, three double bedrooms (one of which is en suite with a dressing room and bathroom), two full bathrooms, and a guest toilet. Next to the kitchen, there is also a laundry room, and all rooms have windows, allowing for cross-ventilation. The renovation of the home, along with its exquisite architectural design, grants it the privilege of being quiet and serene. A true luxury in the heart of historic Madrid and in the Las Letras neighborhood, one of the most vibrant areas of cultural Madrid, surrounded by major museums such as the Prado, Thyssen-Bornemisza, and Reina Sofía, as well as the new luxury epicenter of Madrid like Centro Canalejas, Four Seasons Hotel, and JW Marriott hotel. Undoubtedly a great opportunity to live in a beautiful and cozy home in the heart of Madrid. Located in the Cortes neighborhood, its official name comes from the fact that within this neighborhood is the Congress of Deputies, the lower house of the Cortes Generales of Spain. The more popular nickname among the populace is due to the ""huertas del prado"" that existed in the 17th century on the current Paseo del Prado, which also gives its name to the main street of the neighborhood: Calle de las Huertas, very close to Plaza Neptuno and Plaza Platería Martínez. The location of the apartment is excellent, not only for being in the center of Madrid, next to major museums, but also because it is within the circuit with the most food and service offerings in the city. It is a must-visit area in Madrid to enjoy the atmosphere the city has to offer. The area is home to the Prado and Thyssen-Bornemisza museums, and nearby is the Reina Sofía Art Center, promoted touristically under the designation of Paseo or Triángulo del Arte. It is surrounded by green spaces like the Botanical Garden and very close to Retiro Park, making it perfect for those who want to live in the center of Madrid without losing touch with nature. It is also located in the new luxury area of Centro Canalejas, Four Seasons, and the future JW Marriott. It is the symbolic neighborhood where tradition and avant-garde merge, the cultural focus of the city. The level of infrastructure and services in the area is excellent. It is very well connected by metro and bus. The area features a wide array of trendy small businesses: restaurants, bars, cafés, bookstores, shops, art galleries, and coworking spaces. You can also find cinemas, theaters, and performance venues in the area.",Centro
97396480,2300000,5,4,310,"Teresa Rico Gordillo from GV | NUEVA ESPAÑA is marketing the following property: A wonderful 310 square meter apartment located on one of the best streets in Nueva España. Its spacious areas and light, thanks to the large windows, along with the charm of the fireplace in the living room, undoubtedly make it a space of light and comfort like few others in the heart of Madrid. The entrance hall is of generous dimensions and leads into a large living room with a fireplace and an independent dining area, both very bright due to their large windows. There is a guest bathroom. The kitchen comes with an office and laundry area, all equipped with high-end appliances. There is a service room with a bathroom. In the private area, there are 3 bedrooms, all with spacious en-suite bathrooms, built-in wardrobes, and large windows. Two parking spaces and a storage room (approximately 7m2) are included in the price. The building has two elevators, one main and one service. 24-hour security 365 days a year. Community pool and garden. A significant percentage of our properties are not listed on idealista at the explicit request of the owners. For more information on additional properties in this area, please visit our website.",Nueva España
101861324,2990000,7,5,728,"David Salcedo from GV | PUERTA DE HIERRO is offering the following property: A spacious single-family home in the Colonia Puerta de Hierro. With 728.8 square meters on a 1005 square meter plot. Built with the highest quality materials on the market, it features underfloor heating/cooling, home automation, an elevator shaft, and pre-installation (optional cabin). It includes a garden with a swimming pool. Noteworthy is its excellent location in a quiet environment just minutes away from shopping and leisure areas.

Layout:
Ground Floor: Entrance hall, guest toilet, living-dining room, sitting room, study with bathroom, kitchen, office, pantry, laundry room, drying area.
Upper Floor: Master bedroom with two walk-in closets and bathroom, three suites each consisting of a bedroom, walk-in closet, and bathroom, library, solarium terrace.
Semi-basement: Service room and bathroom, utility room, gym, wine cellar, storage room, garage for four vehicles.

A significant percentage of our properties are not publicly listed due to the owners' express wishes. For more information about additional properties in this area, please visit our website.",Ciudad Universitaria
103872967,1650000,3,4,290,"Impressive 360 penthouse in the heart of Sanchinarro. Engel & Völkers presents this wonderful newly built penthouse, featuring three bedrooms (originally four and easily reversible), three bathrooms, one of which is en suite, and a guest toilet. The property is very spacious and filled with light, enjoying all orientations. It has a total area of 180m2 with a magnificent layout and an impressive 360 terrace totaling 200m2, offering unbeatable views of both Madrid and the northern mountains, along with a small pool for cooling off and enjoyment. A true luxury! 

Upon entering the home, we are greeted by a large hallway that leads to a fantastic living room, very spacious and with an open-plan kitchen, fully integrated into the elegance of this space. The sleeping area is distributed among three bedrooms: a large master bedroom with an en suite bathroom, a dressing room, and a spacious office, along with two other bedrooms that share a bathroom. All bedrooms have access to the terrace, which enhances their brightness. 

The property includes three adjoining garage spaces and a storage room. The home is practically new, having been completed in April 2022. The quality finishes are top-notch, boasting underfloor heating, ducted air conditioning with individual controls in each room, home automation, a pergola, premium joinery and fittings, high-end appliances, and an energy certificate of grade A. 

The urbanization is spectacular, equipped with a concierge and 24-hour security. The building features extensive and well-maintained green areas, a communal lounge, children's play areas, two swimming pools (for adults and children), paddle courts, a gym, and a sauna. 

Its location within the Sanchinarro neighborhood is unbeatable, just two streets from the heart of Sanchinarro, Boulevard Príncipe Carlos, where restaurants, bars, shops, etc., can be found. It is a five-minute walk to El Corte Inglés and the light rail. 

Sanchinarro is a young neighborhood in northern Madrid, bordering the emblematic urbanization of La Moraleja, the Pau de Valdebebas, and the residential area of Las Tablas. Just 15 minutes from the center of Madrid and 10 minutes from the airport, Sanchinarro has become a preferred area for both families and those looking to stay connected to the city center and the most prestigious business area of the capital, without sacrificing the tranquility and comfort provided by life in the urbanizations of Sanchinarro. 

For the younger ones, there is a wide offering of public and private schools, including St. George’s International School, Highlands, El Valle, Valdefuentes, and CEU San Pablo.",Hortaleza
101740243,1990000,5,4,242,"PROMORA MADRID sells a newly built townhouse in the Chamartín neighborhood, Ciudad Jardín area, with a total area of 246 m², featuring 4 bedrooms, all with en-suite bathrooms and a guest toilet. Virtual tour of the property: Exclusive new construction townhouse designed by the prestigious architect Antonio Ruiz Barbarín. A 360º concept that is timeless, practical, functional, yet maintains comfort and warmth, thanks to the materials selected for its construction and the layout and features of its spaces. The building is brand new, meaning no rehabilitation of the existing structure has been carried out; rather, it has been demolished, and a new building has been erected on the vacant lot, which complies with all the required urban planning and legal approvals, and is ready for occupancy. For this reason, it includes a mandatory ten-year insurance for new construction projects. 

Being a comprehensive new build, including foundation and structure, it is important to highlight that, since there are no load-bearing walls, the current pillar distribution allows for a new configuration based on the new owner's needs, creating wide open spaces and optimizing room layouts. The furnished and decorated photos of the property correspond to a Home Staging service that was performed to enhance the spaciousness and potential of the property, although it is sold unfurnished. 

The 242 m² home is distributed over three floors. Access can be made from the main street, through a front garden facing north, or via another back garden facing south, which leads to a pedestrian street. On this floor, there is an entrance hall leading to a service bedroom with an en-suite bathroom. There is also a guest toilet and a spacious kitchen integrated into the living room but separated by glass dividers. The living room has pre-installation for a fireplace. 

On the first floor, there are two double bedrooms, both with wardrobes and en-suite bathrooms. On the third, attic floor, is the master bedroom with a dressing room and en-suite bathroom. 

Among the key features of the construction and material selection, we would like to highlight:
• The roof structure consists of a reinforced concrete slab, providing excellent insulation, with large skylights (Velux) integrated into the roof, ensuring ample natural light indoors.
• Thermal Insulation Exterior System (SATE) creates a continuous envelope that guarantees interior comfort and maximum energy efficiency.
• Exterior carpentry made of laminated and treated pine wood, known for its unique design and quality, features safety double glazing, an air chamber with thermal bridge break according to technical code, ensuring insulation, protection, comfort, and energy efficiency.
• Solid pine melis flooring in the bedrooms and under the eaves.
• Continuous microcement flooring on the ground floor, which combines original aesthetics and cleanliness while facilitating heat/cold distribution from the integrated underfloor heating system.
• Forced ventilation with heat recovery, significantly improving comfort, reducing energy consumption, and enhancing security, operability, and durability while providing instant hot water.
• Climate control and hot water production via aerothermal energy and heat pump, generating heat in winter and cooling in summer, distributed through a controlled underfloor heating system managed by sectoral thermostats.",Ciudad Jardín
102641390,1540000,3,4,345,"Duplex penthouse of 345 m² with a magnificent terrace of 323 m² and fabulous views in Valdemarín. This property stands out for the quality of its construction, its spaciousness and brightness, and its spectacular views. Distribution: MAIN FLOOR: - Entrance hall with spacious wardrobes. - Large living-dining room. - Fully equipped kitchen with office area and covered laundry room. - Master bedroom with en-suite bathroom and spacious wardrobes. - Two additional large bedrooms sharing a full bathroom. UPPER FLOOR: - Bedroom with a full bathroom, all exterior, leading to a large terrace of 323 m² with fabulous views of the mountains and the Madrid skyline. It includes three parking spaces and a storage room. CONTACT US TO DISCOVER HOUSES WE HAVE NOT PUBLISHED. In recent years, it has become one of the most sought-after residential areas in Madrid. Its 4,000 residents have chosen it for its proximity to the capital, its wonderful independent villas and family housing developments with large common areas, and its unique environment next to Monte del Pardo and the racetrack. Perfectly connected, and with the town of Aravaca just a 10-minute walk away, it has immediate access to the M-40, the A-6, and the Castilla road. Not to mention its luxury shopping centers, prestigious schools, and sports clubs. It is here, in Valdemarín (C/Blanca de Castilla nº 11), where Promora assists clients interested in the northwest area of Madrid.",Moncloa
103984291,465000,2,2,104,"APARTMENT IN EXCLUSIVE URBANIZATION WITH PARKING SPACE AND STORAGE Aproperties presents a wonderful apartment in the exclusive Skyline Park urbanization (built in 2022 with a BREEAM sustainability certification), consisting of 2 towers, each 100m tall and 25 floors high. The brand new apartment is located on the 4th floor with a south-facing orientation. It features a living-dining room with an integrated kitchen, 2 bedrooms, and 2 bathrooms. Enjoy fantastic common areas: ground floor pool, panoramic pool on the 25th floor, coworking area, celebration room, gardens, gym, sauna, urban garden, and 24-hour concierge service. The price includes a large parking space and a storage room. Important: it is not subject to the 10% VAT of new construction. Skyline has a strategic location in one of the most promising areas of the capital, with panoramic views over all of Madrid and La Sierra, just a few minutes from Paseo de la Castellana, the 4 Towers, Azca, Chamartín station, the north and northeast access points of the M-30, and numerous green and sports areas. Can you imagine living here? MANY OF OUR PROPERTIES DO NOT APPEAR ON IDEALISTA, CHECK OUR WEBSITE TO SEE MORE EXCLUSIVE PROPERTIES.",Valdeacederas
102684554,1690000,4,5,252,"Única Inmobiliaria Chamartín exclusively offers this extraordinary property, fully renovated with great taste and excellent materials. It features an entrance hall, a courtesy toilet, a spacious living-dining room with access to a pleasant terrace, a large integrated kitchen with an office area, a staff bedroom with a bathroom and independent entrance. On the other side, in the resting area, there are four bedrooms, two of which are en suite; the main one has a large dressing room and another complete bathroom. The property includes ducted air conditioning (cool/warm) and central heating. The price includes a parking space with direct access. It is located within one of the best buildings in the area, featuring beautiful gardens and an extraordinary location, next to El Viso, with all services, amenities, transportation, and shops just a step away. Hispanoamérica is a neighborhood in the Chamartín District, situated in the northeast of Madrid. Its boundaries are to the north by Alberto Alcocer Avenue and Costa Rica Avenue, to the south by Concha Espina Avenue, to the west by Paseo de la Castellana, and to the east by Avenida de la Paz (M-30). It offers a wide range of services, shops, schools, sports facilities, hotels, dining options, hospitals, and clinics, along with a comprehensive public transport system; it is also home to the Santiago Bernabéu Stadium, several embassies, public administrations, and the headquarters of some of Spain's most important companies. At Única Inmobiliaria, a personalized service company with over 19 years of experience and profound knowledge of the sector in the most exclusive areas of Madrid, we have a dynamic team of professionals with higher education and experience in personal advisory services. Our long professional trajectory allows us to offer excellent management and find solutions to each client's needs, aiming for their satisfaction and trust. At Única Inmobiliaria, each client is ""Unique."" WE HAVE MORE PROPERTIES IN THIS AREA THAT ARE NOT PUBLISHED ON IDEALISTA AT THE EXPRESS REQUEST OF THE OWNERS. TO VIEW THEM, CLICK ON THE ÚNICA LOGO OR VISIT OUR WEBSITE unicainmobiliaria.com.",Chamartín
103368945,2200000,3,4,235,"Única Real Estate is marketing this luxury home that is completely exterior with excellent natural light. The property features an entrance hall, a living room and dining room in separate areas, a large kitchen with a laundry terrace, and a relaxation area composed of 4 spacious bedrooms (the main one being en suite) and two additional bathrooms to service the rest of the home. It is located on one of the most emblematic streets in El Viso and is part of an exclusive and beautiful estate with excellent communal areas, a swimming pool, and security among other notable details. It includes two parking spaces with direct access and a storage room in the same building as part of the price. El Viso represents an exclusive residential oasis amidst the urban landscape of the capital, with the main artery being Serrano Street. This prestigious neighborhood was developed by architect Rafael Bergamín in the 1930s with a social vocation and as a retreat area. The lands were located on the outskirts of the city, where a different style of construction was experimented with. Several urban planners of that era, who studied in Germany, imported the new concept of rationalist architecture from that country, which is why many houses in El Viso resemble small palaces. At Única Real Estate, a personalized service company with over 20 years of experience and deep knowledge of the sector in the most exclusive areas of Madrid, we have a dynamic team of professionals with advanced training and experience in personal advisory services. Our long professional history enables us to offer excellent management and find solutions to every client's needs with the goal of achieving their satisfaction and trust. At Única Real Estate, every client is ""Unique."" WE HAVE MORE PROPERTIES IN THIS AREA THAT ARE NOT PUBLISHED ON IDEALISTA AT THE EXPRESS REQUEST OF THE OWNERS. TO VIEW THEM, CLICK ON THE ÚNICA LOGO OR VISIT OUR WEBSITE unicainmobiliaria.com.",Chamartín
103392553,500000,2,2,99,"Elegant and modern property in La Latina, Palacio. Engel & Völkers presents this elegant and modern property in the heart of the vibrant La Latina neighborhood. It is an exterior property located on the third floor of a building from 1900. The renovation is of high quality, resulting in an extremely comfortable and cozy home. The apartment, which has 99 m² very well distributed, is incredibly bright in all its rooms. The kitchen and living room face east and south and feature a wonderful balcony overlooking one of Madrid's most famous streets. The kitchen is very modern and fully equipped with high-quality appliances. The two bedrooms in the property have built-in wardrobes and windows overlooking two different interior courtyards. One of them is oriented to the west and is very open and spacious. The property has two full bathrooms, one of which is en suite with the main bedroom. The property is equipped with an Aerothermal heating and cooling system. The home boasts a unique location in the modern La Latina neighborhood in Palacio, close to Puerta de Toledo, Plaza de la Cebada, El Rastro, and Madrid Río. Additionally, the apartment offers wide views to the south of Madrid. The property is situated in one of the most popular areas of the city, La Latina, with countless streets, squares, monuments, and buildings that have made their mark on Madrid's history. Just a few minutes away, you will find the Plaza de la Cebada street, El Rastro, Puerta de Toledo, and Madrid Río, among others. The demand in the district is on the rise as the city's preservation along with its history is maintained while being updated for today's needs and luxuries. The area stands out for its numerous restaurants, cafes, taverns, shops, hostels, and a great cosmopolitan variety. The communications are excellent, whether through the M30, Metro, bus, or Renfe.",Centro
98040774,715000,1,2,117,"In the Salamanca district, on one of the best streets of Castellana, near Diego de León street, Única Inmobiliaria presents a residence located in a representative building. It is on the 2nd floor, as there is a high mezzanine. The apartment measures 117 m² and has a northeast orientation towards a quiet interior patio. It features 2 double bedrooms, 1 spacious bathroom, and a guest toilet. Excellent qualities: aluminum windows, white lacquered doors, parquet flooring, and air conditioning. A storage room of approximately 5 m² is included in the price. The building has a physical doorman, a wide and elegant entrance, and easy access for individuals with reduced mobility. At Única Inmobiliaria, a personalized service company with over 19 years of experience and in-depth knowledge of the sector in the most exclusive areas of Madrid, we have a dynamic team of professionals with higher education and experience in personal advisory services. Our long professional trajectory allows us to offer excellent management and find solutions to the needs of each client with the aim of achieving their satisfaction and trust. At Única Inmobiliaria, every client is ""Unique."" WE HAVE MORE PROPERTIES IN THIS AREA THAT ARE NOT PUBLISHED ON IDEALISTA AT THE EXPRESS REQUEST OF THE OWNERS. TO SEE THEM, CLICK ON THE ÚNICA LOGO OR VISIT OUR WEBSITE unicainmobiliaria.com.",Barrio de Salamanca
99170917,1300000,4,3,133,"NEW APARTMENT WITH CONCIERGE IN A REGAL BUILDING ON JORGE JUAN. AProperties presents a fantastic and elegant brand new apartment in a prime location, featuring an excellent renovation. Located on the first floor of a 1891 building, it offers 133 m² of living space. From the entrance, we directly access the living-dining room, fully adorned with washed wood that provides an exceptional design. The kitchen, modern in style, is independent, fully equipped with ample storage capacity, and features a large island. A guest bathroom is available for visitors. The sleeping area consists of four double bedrooms, all en-suite, with the main one additionally featuring a spacious dressing room, freestanding bathtub, large shower, and double sink. It is essential to highlight the thoughtful renovation carried out, both for its modern design, making effective use of wood and other noble materials, and for its excellent execution. This fantastic apartment comes with ducted air conditioning, heating, and communal hot water through designer radiators. Being situated in an internal area, the building does not have an elevator; the access stairs, with wrought iron railings, are representative and protected. The elegant entrance hall is regal, typical of that era, with high ceilings and features a concierge. Undoubtedly a unique, bright property in an excellent location. Can you imagine living here? MANY OF OUR PROPERTIES DO NOT APPEAR ON IDEALISTA; CHECK OUR WEBSITE FOR MORE EXCLUSIVE PROPERTIES.",Recoletos
